子午,● 자오충이 있으면 소심한 경향이 있고 매사에 전전긍긍 합니다..,● 자오충이 있는 사주는 무역이나 정치 분야쪽으로 나가는 경우가 있는데 실속 없이 동분서주하는 경향이 있습니다..,● 年. 月에 자오충이 있으면은 본인이나 가족 중에서 외국에 사는 경우가 종종 발생 합니다..,● 자오충의 의미 정리,가. 극단과 극단의 충 = 엄청난 파괴력. 강력한 변화와 변동,나. 오행 화와 수의 특성 = 주로 정신적인 영역에서 발동,다. 지장간의 특성 = 뒤끝이 없는 충돌. 아주 깔끔하고 기분좋은 충돌,라. 왕지와 왕지의 충돌 = 강한 힘의 충돌. 뒤끝이 없음. 에너지가 집중됨
卯酉,● 충 중에서 묘유충은 배신. 원수 또는 극단적인 충이라 하여 충력이 제일 강하기 때문에 가장 꺼립니다..,● 사주에 묘유충이 있으면은 부부불화로 인해 안정된 가정을 갖기 어렵고 또한 안정된 직업도 갖기가 어렵습니다..,● 권력과 재물에 대한 집념이 강해 양보와 타협을 모르고 생사를 건 치열한 다툼으로 가까운 주변과의 사이에 신의나 우애가 없습니다..,● 묘유충의 의미 정리,가. 봄과 가을의 극한 대립 = 한치도 양보할 수 없는 대립,나. 오행 목과 금의 특성 = 뼈의 건강. "폐". "간"의 건강에 관여,다. 지장간의 특성 = 아주 깔끔한 결론. 질질 끌지 않음. 실제적이고 직접적인 충돌,라. 왕지와 왕지의 충돌 = 극단적 성패. 결단을 잘 내리는 성격
寅申,● 인신충은 역마성이 있어 활동력은 좋으나 용두사미격이 많습니다..,● 인신충은 남녀 간에 애정의 풍파를 암시합니다..,,● 인신충의 의미 정리,가. 2인자들의 충돌 = 극렬. 과감. 치열한 충돌,나. 오행 목과 금의 특성 = 실제적인 발현. 교통사고. 하체관련 장애를 의미,다. 지장간의 특성 = 좌충우돌. 예측불가능성. 강한 에너지 발현,라. 생지와 생지의 출동 = 이동에 있어서의 불확실성 증가. 죽은 자를 되살리는 생생함
巳亥,● 사해충은 하지 않아도 될 일을 만들어서 걱정하거나 매사에 일관성 없이 갈팡질팡으로 후회하거나 소심해지는 경향이 있습니다..,● 고향이 아닌 타지역에서 사는 경우가 많습니다..,● 사해충이 이루어질 경우 폭발이나 화재 또는 교통사고 등이 우려되고 심장질환.고혈압 등의 질병이 많이 발생합니다..,● 사해충의 의미 정리,가. 극단을 이루기 이전의 힘끼리의 충돌 = 치열하고 집요한 충돌,나. 오행 화와 수의 특성 = 정신적인 번민과 굴곡,다. 지장간의 특성 = 물러설 수 없는 충돌. 복잡하고 미묘한 충돌. 이겼지만 이기지 못하고. 졌지만 질 수 없는 끈적한 충돌,라. 생지와 생지의 충돌 = 정신적 측면에서 강한 역마의 엉킴이 발동. 정신적인 부지런함 혹은 번민
辰戌,● 재물이 제일주의로 주변으로 부터 외면을 당하는 경우가 많습니다..,● 사주에 진술충이 있으면은 이성관계로 종종 말썽이 발생할 우려가 있고. 귀인의 도움을 받기 힘들어서 일명 고독의 충이라고도 합니다..,● 사주에 진술충이 있으면은 땅과 집이 관련된 관재구설. 송사 등이 많이 발생합니다..,● 진술충의 의미 정리,가. 저무는 자들의 충돌 = 충의 효과가 미미함,나. 오행 토의 성질 = 충의 효과는 미미한 가운데 내면의 지체. 고고한 취향,다. 지장간의 특성 = 소소한 갈등의 양상. 허세의 와중에 실리를 다투는 것,라. 고지와 고지의 충돌 = 강한 방어태세로 인한 효과 반감
丑未,● 사주에 축미충이 있으면은 자칫 형제나 친구 또는 친척들과 멀어지거나 소외당하기 쉽습니다..,● 사주에 축미충이 있는 사람은 가족 등 주변과의 화목을 위해 무엇보다도 배우자를 잘 선택해야 합니다..,,● 축미충의 의미 정리,가. 저무는 자들의 충돌 = 충의 효과가 미미함,나. 오행 토의 성질 = 충의 효과는 미미한 가운데 심리적 방황과 현실의 추구,다. 지장간의 특성 = 소소한 갈등의 양상. 견고한 성채를 유지하는 힘,라. 고지와 고지의 충돌 = 강한 방어태세로 인한 효과 반감